{
  "legacy": {
    "phase_1_full_timing_artifact": null,
    "read_bursts_observed": true,
    "tick_max_ms": 26.0,
    "x008_read_failure_percent": 2.68,
    "x0_read_failure_percent": 1.07
  },
  "new": {
    "backend": "mock",
    "bus_total_ms": {
      "max": 2.6741,
      "mean": 1.9239222,
      "min": 0.9539,
      "p95": 2.04372,
      "p99": 2.0768020000000003,
      "p99_9": 2.5578164000000108
    },
    "environment": {
      "amplitude_rad": 0.03,
      "baudrate": 1000000,
      "config_path": null,
      "config_sha256": null,
      "device": "mock://sts3215",
      "frequency_hz": 50.0,
      "hardware_authorized": false,
      "moving_gate_authorized": false,
      "platform": "Windows-10-10.0.26200-SP0",
      "python": "3.10.11",
      "realtime": null,
      "sine_hz": 0.5,
      "sine_joint": "left_hip_yaw",
      "suspended_or_benched": false,
      "telemetry_records_dropped": 0,
      "timeout_ms": 4.0,
      "torque_enabled": false,
      "torque_off_status": "ok",
      "watchdog_consecutive_failures": 3
    },
    "extended_round_trip_ms": {
      "max": 0.0047,
      "mean": 0.0017538,
      "min": 0.0005,
      "p95": 0.0029,
      "p99": 0.0036,
      "p99_9": 0.004300400000000036
    },
    "gates": {
      "authorization_provenance": true,
      "bus_max_under_5_ms": true,
      "complete_record_stream": true,
      "gate2_home_hold_candidate": false,
      "gate4_sine_candidate": false,
      "moving_gate_scope": true,
      "realtime_verified_when_required": true,
      "tick_p99_9_at_most_22_ms": false,
      "tick_p99_at_most_21_ms": false,
      "torque_off_confirmed": true,
      "tracking_p95_at_most_0_011_rad": true,
      "transaction_failure_below_0_1_percent": true,
      "zero_read_bursts": true
    },
    "group_round_trip_ms": {
      "max": 2.6627,
      "mean": 1.9093809000000002,
      "min": 0.9415,
      "p95": 2.0275,
      "p99": 2.0599619999999996,
      "p99_9": 2.5439189000000106
    },
    "halt_reason": null,
    "hardware_gate_status": "NOT_APPLICABLE_MOCK",
    "informational_only": true,
    "jsonl_sha256": "d216e231599bbc60e5cf613964db54556b52171c27df570f944d3efdaf2817a1",
    "max_read_burst_ticks": 0,
    "partial_byte_count": 0,
    "read_burst_count": 0,
    "release_lateness_ms": {
      "max": 2.8297,
      "mean": 1.2618490000000002,
      "min": 0.0003,
      "p95": 2.546125,
      "p99": 2.7443699999999995,
      "p99_9": 2.7990307000000025
    },
    "review_status": "INFORMATIONAL_ONLY",
    "run_status": "COMPLETE",
    "schema_version": "open_duck_x5.timing_summary.v2",
    "tick_period_ms": {
      "max": 22.0199,
      "mean": 20.001105305305305,
      "min": 17.9739,
      "p95": 21.98114,
      "p99": 21.9998,
      "p99_9": 22.019401000000002
    },
    "ticks": 1000,
    "ticks_requested": 1000,
    "tracking_absolute_error_rad": {
      "max": 0.0034631801101951227,
      "mean": 0.0021956972319304366,
      "min": 0.0,
      "p95": 0.003451687978265439,
      "p99": 0.0034631801095548493,
      "p99_9": 0.00346318010955564,
      "samples": 1000
    },
    "tracking_joint_index": 0,
    "transaction_failure_counts": {
      "crc": 0,
      "device": 0,
      "io": 0,
      "partial": 0,
      "timeout": 0,
      "unexpected_id": 0,
      "unexpected_packet": 0
    },
    "transaction_failure_percent": 0.0,
    "transaction_failure_rate": 0.0,
    "transaction_status_counts": {
      "crc": 0,
      "device": 0,
      "io": 0,
      "ok": 16000,
      "partial": 0,
      "timeout": 0,
      "unexpected_id": 0
    },
    "transactions_expected": 16000,
    "transactions_failed": 0,
    "unexpected_packet_count": 0
  },
  "new_summary_source": {
    "path": "artifacts/runs/mock/summary.json",
    "sha256": "4dac992d0cbb57951f37c2079007002d7816edb78c4c55d47e807d64b392941b"
  },
  "schema_version": "open_duck_x5.baseline_comparison.v1",
  "status": "INFORMATIONAL_MOCK"
}
